{
  "api": {
    "response_sha256": "ffefdf50d54770c2a20ba143e42daa910535c20ec5ca7a1e449dac71729f00fe",
    "status_code": 200,
    "url": "https://jsonplaceholder.typicode.com/todos/1",
    "validation_errors": [],
    "validation_passed": true
  },
  "generated_utc": "2026-03-19T14:37:31.511858+00:00",
  "run": {
    "platform": "linux",
    "python": "3.8.2"
  },
  "schema_version": "1.0",
  "student": {
    "group": "IB-23-5b",
    "name": "Akhmetov",
    "token": "D1-IB-23-5b-01-1A3F"
  }
}
